{
  "date": "2026-05-15",
  "generated_at": "2026-05-15T09:30:00+08:00",
  "meta": {
    "total_scanned": 67,
    "outliers_found": 5,
    "theme": "今天的爆款都在帮你作弊 — 用光疗骗过年龄、用AI骗过语言、用穿戴甲骗过美甲店、用怀旧玩具骗过成年、用补剂骗过生物钟。消费者在用智慧和技术走捷径，这些商品就是他们的作弊码。",
    "cover_image_prompt": "A cyberpunk-inspired digital illustration showing five glowing 'cheat code' items floating in a dark neon space: a luminous LED face mask, wireless earbuds with language symbols, holographic press-on nails, a web-shooter toy, and a glowing supplement bottle, all connected by neon circuit lines, dark background with purple and cyan accents"
  },
  "products": [
    {
      "rank": 1,
      "name": "AI实时翻译耳机",
      "category": "消费电子 / 旅行科技",
      "price_range": "$11.60 – $420",
      "platforms": [
        {"name": "TikTok", "rank": null, "trend_signal": "spiking", "notes": "旅行+AI双标签叠加，短视频演示翻译效果转化极高"},
        {"name": "Temu", "rank": 1, "trend_signal": "new_entry", "notes": "$11.60 Temu款与$420 AirPods极端价差引发大量对比评测"},
        {"name": "Amazon", "rank": 15, "trend_signal": "rising", "notes": "Timekettle W4、SonaBuds等多品牌进入畅销榜"},
        {"name": "AliExpress", "rank": 8, "trend_signal": "sustained_high", "notes": "韩国市场桌面/数码品类持续霸榜"}
      ],
      "anomaly_reason": "同一品类出现极端价格带（$11.60 vs $420），两极产品同时在各大平台获得高关注度，说明市场正在快速扩张且尚未形成品牌垄断。Temu低价款通过TransKit App间接实现了AI翻译功能，引爆了'廉价版AirPods翻译'话题。",
      "anomaly_score": 88,
      "voc_analysis": {
        "summary": "消费者对AI翻译耳机的核心诉求不是'翻译'本身，而是'降低跨语言社交的尴尬感'。旅途中能自然对话而不是掏出手机打字，这种社交体面感是真正的购买驱动力。平价款的爆发说明大量用户的需求是'够用就行'——餐厅点餐、酒店入住、简单问路，不需要同声传译级别。",
        "key_themes": [
          "旅行社交焦虑缓解 — 不想在外国人面前掏出手机对讲",
          "价格锚定效应 — Temu $11.60 vs Apple $420 的对比内容自带病毒传播力",
          "离线翻译刚需 — 境外流量贵/不稳定，离线功能决定实用性",
          "隐藏订阅陷阱 — 用户反感'硬件便宜但年费$50+'的模式",
          "双模交互需求 — 可戴可拿的对话模式比纯入耳式更实用"
        ],
        "sentiment": {"positive_pct": 68, "neutral_pct": 22, "negative_pct": 10},
        "sources": ["Reddit r/headphones", "Amazon reviews", "TikTok #translationearbuds", "什么值得买/SMZDM", "StartupDaily评测"],
        "quotes": [
          {"text": "I used the $11.60 Temu buds in Japan for a week — they're not perfect but they got me through every restaurant order and hotel check-in. Best $12 I ever spent for travel.", "source": "StartupDaily深度评测评论区"},
          {"text": "买之前以为140种语言很厉害，实际用才发现我只在乎中日英三种，其他137种都是摆设。", "source": "什么值得买 2026选购指南评论区"},
          {"text": "The real value isn't accuracy — it's that I don't have to hand my phone to a stranger to type stuff anymore.", "source": "Reddit r/digitalnomad"}
        ]
      },
      "business_analysis": {
        "opportunity_level": "🔥 必跟",
        "profit_potential": "中端定位（$49-$89）利润空间最大。华强北白牌成本$8-15，加App授权后可做到$49零售，净利润率60-70%。避开$20以下价格战红海和$200+品牌壁垒区，切$49-79的中产旅行者是蓝海。",
        "supply_complexity": "中（需要找工厂）",
        "competition_density": "温和（有空间）",
        "trend_sustainability": "长期趋势。AI翻译精度每年提升，跨境旅行持续恢复，远程工作全球化，翻译耳机的场景只会越来越多。预计3-5年稳定增长。",
        "actionable_tips": [
          "主攻中端空白带（$49-79），配独立App + 离线包，避开低价泥潭和品牌正面战",
          "内容营销强调'社恐救星'场景而非技术参数：餐厅点餐、酒店前台、路边问路",
          "重点市场：日本入境游（2026大阪世博预热）+ 东南亚跨境商务 + 欧洲多国旅行路线"
        ]
      }
    },
    {
      "rank": 2,
      "name": "家用红光美容面罩",
      "category": "美容科技 / 个人护理",
      "price_range": "$50 – $350",
      "platforms": [
        {"name": "TikTok", "rank": 1, "trend_signal": "spiking", "notes": "TikTok Shop美容设备品类增长400%，直播转化率26%"},
        {"name": "Amazon", "rank": 12, "trend_signal": "rising", "notes": "CurrentBody、Omnilux等品牌评价数千条"},
        {"name": "Etsy", "rank": 20, "trend_signal": "new_entry", "notes": "小众品牌、配件（收纳包、替换绑带）开始出现"}
      ],
      "anomaly_reason": "医疗级设备（医院皮肤科用的光疗技术）下沉到家用消费品，且增速（400%）远超传统美容品类。非传统美妆品牌（照明公司Nanoleaf）开始跨界进入。Reddit上形成了专业讨论社区，用户自发对比辐照度参数——这种'参数党'行为通常在科技产品而非美容产品中出现。",
      "anomaly_score": 85,
      "voc_analysis": {
        "summary": "购买家用红光面罩的人分两派：'科技护肤党'研究波长/辐照度/临床数据，像买显卡一样买面罩；'懒人美容党'单纯不想去美容院但想要效果。两个群体都高度依赖Reddit和评测内容做决策。最大抱怨不是没效果，而是'效果太慢'和'便宜的没效果，有效果的太贵'。",
        "key_themes": [
          "参数党崛起 — 消费者自发研究630-660nm波长、20mW/cm²辐照度等技术指标",
          "面板vs面罩之争 — 面板功率高但需要坐着不动，面罩可以边做家务边用",
          "质保焦虑 — 多个品牌在质保期结束前出现控制器/电池故障",
          "效果渐进 — 4-8周才能看到细微改善，冲动购买者容易失望",
          "蓝光争议 — 含蓝光的祛痘模式是否伤眼引发大量讨论"
        ],
        "sentiment": {"positive_pct": 62, "neutral_pct": 25, "negative_pct": 13},
        "sources": ["Reddit r/redlighttherapy", "Reddit r/skincareaddiction", "Amazon reviews", "Dermatology Times", "TikTok #redlighttherapy"],
        "quotes": [
          {"text": "用了6周，同事问我是不是换了粉底。我没换，是红光面罩让皮肤细腻了。但前4周真的很想放弃，完全看不出变化。", "source": "Reddit r/redlighttherapy"},
          {"text": "Don't buy those $30 Amazon masks. Minimum 20mW/cm² irradiance or you're just wearing a fancy Halloween costume.", "source": "Reddit r/redlighttherapy 高赞评论"},
          {"text": "I've spent more on facials in 3 months than this mask costs. Now I just Netflix-and-LED for 10 minutes and my skin looks the same.", "source": "CurrentBody Mask Amazon review"}
        ]
      },
      "business_analysis": {
        "opportunity_level": "⭐ 关注",
        "profit_potential": "高利润但高研发门槛。白牌/低价品（<$50）已被Reddit社区'判死刑'。中端（$99-$199）需要临床数据背书和KOL推广。真正高利润在配件生态：替换绑带、收纳包、搭配用的凝胶/精华。",
        "supply_complexity": "高（定制/认证门槛）",
        "competition_density": "红海（激烈）",
        "trend_sustainability": "长期趋势但将经历洗牌。技术门槛提升（消费者越来越懂参数）会淘汰低价劣质品。2025年JAAD共识评审为光疗正名，医学背书将持续推动需求。3-5年后可能像电动牙刷一样普及。",
        "actionable_tips": [
          "不要做低价白牌——Reddit社区会主动曝光参数虚标，负面口碑传播极快",
          "做配件生态而非硬件：红光面罩专用收纳架、可替换绑带、搭配使用的透明质酸精华",
          "内容策略瞄准'4周挑战'：鼓励用户拍照记录，利用前后对比UGC做自然传播"
        ]
      }
    },
    {
      "rank": 3,
      "name": "穿戴甲 / 按压式美甲",
      "category": "美容个护 / 平价时尚",
      "price_range": "$7 – $25",
      "platforms": [
        {"name": "TikTok", "rank": 3, "trend_signal": "spiking", "notes": "#pressonnails话题数十亿播放，换甲如换衣的新消费习惯"},
        {"name": "Amazon", "rank": 8, "trend_signal": "sustained_high", "notes": "BTArtbox、KISS等品牌月销10万+套"},
        {"name": "Shein", "rank": 5, "trend_signal": "rising", "notes": "$3-5一套的超低价快时尚化，每周上新几十款"},
        {"name": "Etsy", "rank": 12, "trend_signal": "sustained_high", "notes": "独立设计师手绘款$15-25，定制化高利润"}
      ],
      "anomaly_reason": "一个$10的产品正在系统性替代$80-120/月的美甲店消费。这不是消费降级，而是'体验升级'——消费者发现穿戴甲比做美甲更快（5分钟vs2小时）、更健康（不伤指甲）、更多样（每周换款）。UV固化技术的引入让穿着时间从3-5天提升到3-4周，彻底抹平了与传统美甲的差距。",
      "anomaly_score": 82,
      "voc_analysis": {
        "summary": "穿戴甲用户的忠诚度极高——一旦找到合适品牌/尺码，几乎不会再回到美甲店。核心驱动力是'自主权'：想换就换、不伤指甲、不用预约、不用社交（社恐友好）。负面反馈集中在尺码适配（指甲床偏大/偏小找不到合适款）和胶水残留问题。",
        "key_themes": [
          "社恐友好消费 — 不用和美甲师尬聊，5分钟自己搞定",
          "健康觉醒 — 不磨指甲、不照UV灯、不用丙酮卸，天然指甲不再变薄",
          "尺码焦虑 — 指甲床偏大或偏小的人很难找到完美贴合的品牌",
          "胶水玄学 — 换胶水（Curvlife半固态胶 + UV灯）能让效果翻倍，但学习成本高",
          "收集癖 — 每周买新款，囤几十套，穿戴甲变成了收藏品"
        ],
        "sentiment": {"positive_pct": 78, "neutral_pct": 15, "negative_pct": 7},
        "sources": ["Reddit r/nails", "Reddit r/beauty", "Business Insider评测", "Cosmopolitan评测", "LipstickAlley论坛"],
        "quotes": [
          {"text": "I haven't been to a nail salon in 8 months. My natural nails are healthier than ever and I've saved over $800.", "source": "Reddit r/beauty"},
          {"text": "关键是换胶水！自带的胶水最多3天，换Curvlife半固态胶+UV灯固化可以撑3周。别用自带的胶水。", "source": "Reddit r/nails 高赞技巧"},
          {"text": "I have 47 sets. I don't even wear half of them — I just like collecting the designs.", "source": "LipstickAlley论坛"}
        ]
      },
      "business_analysis": {
        "opportunity_level": "🔥 必跟",
        "profit_potential": "极高。生产成本$0.50-2/套（1688批发价¥3-15），零售$8-25，毛利率80%+。独立设计师手绘款零售$20-35，按工时算利润稍低但品牌溢价强。订阅制（每月自动寄新款）是拉高LTV的最佳模式。",
        "supply_complexity": "低（现货充足）",
        "competition_density": "温和（有空间）",
        "trend_sustainability": "长期趋势且仍在加速。'在家美容'是后疫情时代的结构性行为变化，穿戴甲品类2024-2028 CAGR预计超过12%。UV固化技术的普及将进一步提高留存率。",
        "actionable_tips": [
          "切细分尺码市场：专做大码/小码/加宽指甲床的穿戴甲，这是红海中最大的蓝海——几乎每个Reddit帖子里都有人在抱怨找不到合适的尺码",
          "做订阅制：$15/月自动寄2套新款，拉高LTV和复购率，用户已有'收集癖'心理基础",
          "配售Curvlife等高端胶水+迷你UV灯作为增值套装，客单价可从$10提升到$25-30"
        ]
      }
    },
    {
      "rank": 4,
      "name": "NAD+ / 皮质醇管理补剂",
      "category": "保健品 / 生物黑客",
      "price_range": "$25 – $120",
      "platforms": [
        {"name": "TikTok", "rank": 5, "trend_signal": "spiking", "notes": "欧洲TikTok Shop保健品增速300%+，NAD+和cortisol manager是网红品类"},
        {"name": "Amazon", "rank": 18, "trend_signal": "rising", "notes": "Integrative Therapeutics等品牌评价数千条，但ReviewMeta发现101条疑似删评"},
        {"name": "eBay", "rank": 25, "trend_signal": "new_entry", "notes": "单瓶/试用装流通活跃，消费者在尝试不同品牌"}
      ],
      "anomaly_reason": "生物黑客（biohacking）——一个曾经属于硅谷极客和长寿科学家的冷门领域——正在通过TikTok走向大众。NAD+注射剂和皮质醇管理补充剂同时爆发，说明消费者从'治病'转向'优化'——不想等到病了再治，而是要主动提升精力/睡眠/情绪。但品类面临严重的信任危机：Amazon疑似删评、Reddit上效果两极化、医学背书不足。",
      "anomaly_score": 80,
      "voc_analysis": {
        "summary": "补剂消费者的心态很矛盾：既相信科学（会主动查论文、追Huberman播客），又容易冲动消费（TikTok刷到就下单）。NAD+注射剂的效果反馈强烈但副作用也明显（注射痛、睡眠紊乱）。皮质醇管理补剂（含南非醉茄+茶氨酸）睡眠改善效果好评率高，但约10%用户反馈焦虑加重——个体差异极大。",
        "key_themes": [
          "Huberman效应 — Andrew Huberman等播客主推荐直接转化为购买，效果堪比明星代言",
          "睡眠是第一痛点 — 皮质醇管理补剂的核心卖点不是'减压'而是'让我睡个好觉'",
          "效果两极化 — 有人称之为'人生改变'，有人感觉'完全没用还贵'",
          "评价操纵阴影 — Amazon删评事件让消费者对整个品类产生不信任",
          "注射vs口服之争 — NAD+注射效果强但成本高/体验差，口服NMN/NR方便但吸收率存疑"
        ],
        "sentiment": {"positive_pct": 55, "neutral_pct": 27, "negative_pct": 18},
        "sources": ["Reddit r/biohacking", "Reddit r/supplements", "Amazon reviews", "Peachiv用户聚合", "TikTok #biohacking"],
        "quotes": [
          {"text": "NAD+ injections are one of the most substantial biohacking interventions I've done. Double workout capacity, extremely high energy, very low anxiety.", "source": "Reddit r/biohacking 31M用户"},
          {"text": "NMN gave me such bad sleep that I quit after 5 years. Brain racing at 3am every night. Not worth it.", "source": "Reddit r/supplements"},